{
  "$schema": "https://json-schema.org/draft/2020-12/schema",
  "$id": "https://github.com/RewardopediaHQ/rewardopedia-plugin/schemas/claude-plugin.schema.json",
  "title": "Claude Code plugin manifest (repository subset)",
  "description": "The subset of .claude-plugin/plugin.json fields this repository uses, from https://code.claude.com/docs/en/plugins/manifest-reference (retrieved 2026-09-27). The official check is `claude plugin validate --strict`.",
  "type": "object",
  "properties": {
    "$schema": {
      "type": "string"
    },
    "name": {
      "type": "string",
      "pattern": "^[a-z0-9]+(?:-[a-z0-9]+)*$"
    },
    "displayName": {
      "type": "string",
      "minLength": 1
    },
    "version": {
      "type": "string",
      "minLength": 1
    },
    "description": {
      "type": "string",
      "minLength": 1
    },
    "author": {
      "type": "object",
      "properties": {
        "name": {
          "type": "string",
          "minLength": 1
        },
        "email": {
          "type": "string"
        },
        "url": {
          "type": "string",
          "format": "uri"
        }
      },
      "required": ["name"],
      "additionalProperties": false
    },
    "homepage": {
      "type": "string",
      "format": "uri"
    },
    "repository": {
      "type": "string",
      "format": "uri"
    },
    "license": {
      "type": "string"
    },
    "keywords": {
      "type": "array",
      "items": {
        "type": "string"
      }
    }
  },
  "required": ["name", "version", "description", "author"],
  "additionalProperties": false
}
